<?xml version="1.0" encoding="UTF-8"?>
<xs:schema xmlns:xs="http://www.w3.org/2001/XMLSchema" elementFormDefault="qualified">

  <!-- Include the shared types schema -->
  <xs:include schemaLocation="types.xsd"/>

  <!-- Port Directions / Kinds -->
  <xs:simpleType name="PortDirection">
    <xs:restriction base="xs:string">
      <xs:enumeration value="in"/>
      <xs:enumeration value="out"/>
    </xs:restriction>
  </xs:simpleType>

  <!-- Relation Kinds Between Input and Output Types -->
  <xs:simpleType name="RelationKind">
    <xs:restriction base="xs:string">
      <xs:enumeration value="intersection"/>
      <xs:enumeration value="union"/>
      <xs:enumeration value="identity"/>
      <xs:enumeration value="map"/>
      <xs:enumeration value="subtype"/>
      <xs:enumeration value="supertype"/>
      <xs:enumeration value="custom"/>
    </xs:restriction>
  </xs:simpleType>

  <!-- Block Setting and Parameter Kinds -->
  <xs:simpleType name="ParameterKind">
    <xs:restriction base="xs:string">
      <xs:enumeration value="integer-parameter"/>
      <xs:enumeration value="count-parameter"/>
      <xs:enumeration value="decimal-parameter"/>
      <xs:enumeration value="duration-parameter"/>
      <xs:enumeration value="date-parameter"/>
      <xs:enumeration value="time-parameter"/>
      <xs:enumeration value="date-time-parameter"/>
      <xs:enumeration value="integer-range-parameter"/>
      <xs:enumeration value="double-range-parameter"/>
      <xs:enumeration value="text-parameter"/>
      <xs:enumeration value="setting"/>
      <xs:enumeration value="parameter"/>
    </xs:restriction>
  </xs:simpleType>

  <!-- Duration Type (e.g. 100ms, 1s, 10000ns, 1d, 30m, 1h) -->
  <xs:simpleType name="DurationType">
    <xs:restriction base="xs:string">
      <xs:pattern value="[0-9]+(\.[0-9]+)?(ns|us|ms|s|m|h|d)"/>
    </xs:restriction>
  </xs:simpleType>

  <!-- Port Definition (in/out) supporting string type or structured type elements -->
  <xs:complexType name="PortDef">
    <xs:choice minOccurs="0" maxOccurs="unbounded">
      <xs:element name="attribute" type="AttributeDef"/>
      <xs:element name="var" type="TypeVarRef"/>
      <xs:element name="raw-type" type="RawTypeRef"/>
      <xs:element name="type" type="PortTypeRef"/>
      <xs:element name="wildcard" type="WildcardTypeDef"/>
      <xs:element name="intersection" type="IntersectionTypeDef"/>
      <xs:element name="union" type="UnionTypeDef"/>
    </xs:choice>
    <xs:attribute name="name" type="xs:string" use="required"/>
    <xs:attribute name="type" type="TypeString"/>
    <xs:attribute name="direction" type="PortDirection"/>
    <xs:attribute name="vararg" type="xs:boolean" default="false"/>
    <xs:attribute name="icon" type="xs:string"/>
    <xs:attribute name="relation" type="RelationKind"/>
    <xs:attribute name="relatesTo" type="xs:string"/>
  </xs:complexType>

  <!-- Type Relation Definition: represents relations between input types and output types -->
  <xs:complexType name="TypeRelationDef">
    <xs:sequence>
      <xs:element name="attribute" type="AttributeDef" minOccurs="0" maxOccurs="unbounded"/>
      <xs:element name="in" type="xs:string" minOccurs="0" maxOccurs="unbounded"/>
      <xs:element name="out" type="xs:string" minOccurs="0" maxOccurs="unbounded"/>
    </xs:sequence>
    <xs:attribute name="name" type="xs:string"/>
    <xs:attribute name="kind" type="RelationKind" default="intersection"/>
    <xs:attribute name="from" type="xs:string"/>
    <xs:attribute name="to" type="xs:string"/>
    <xs:attribute name="input" type="xs:string"/>
    <xs:attribute name="output" type="xs:string"/>
    <xs:attribute name="param" type="xs:string"/>
    <xs:attribute name="type" type="TypeString"/>
    <xs:attribute name="expression" type="xs:string"/>
  </xs:complexType>

  <!-- Base Parameter Definition for Configurable Block Settings and Constants -->
  <xs:complexType name="ParamBaseDef" abstract="true">
    <xs:sequence>
      <xs:element name="attribute" type="AttributeDef" minOccurs="0" maxOccurs="unbounded"/>
    </xs:sequence>
    <xs:attribute name="name" type="xs:string" use="required"/>
    <xs:attribute name="type" type="TypeString"/>
    <xs:attribute name="description" type="xs:string"/>
  </xs:complexType>

  <!-- General Setting / Parameter Definition -->
  <xs:complexType name="SettingDef">
    <xs:complexContent>
      <xs:extension base="ParamBaseDef">
        <xs:attribute name="kind" type="ParameterKind"/>
        <xs:attribute name="default" type="xs:string"/>
        <xs:attribute name="min" type="xs:double"/>
        <xs:attribute name="max" type="xs:double"/>
        <xs:attribute name="step" type="xs:double"/>
        <xs:attribute name="minChars" type="xs:nonNegativeInteger"/>
        <xs:attribute name="maxChars" type="xs:positiveInteger"/>
        <xs:attribute name="pattern" type="xs:string"/>
      </xs:extension>
    </xs:complexContent>
  </xs:complexType>

  <!-- Integer Parameter Declaration -->
  <xs:complexType name="IntegerParamDef">
    <xs:complexContent>
      <xs:extension base="ParamBaseDef">
        <xs:attribute name="default" type="xs:integer"/>
      </xs:extension>
    </xs:complexContent>
  </xs:complexType>

  <!-- Count Parameter Declaration (Up/Down control) -->
  <xs:complexType name="CountParamDef">
    <xs:complexContent>
      <xs:extension base="ParamBaseDef">
        <xs:attribute name="min" type="xs:integer" default="0"/>
        <xs:attribute name="max" type="xs:integer"/>
        <xs:attribute name="step" type="xs:integer" default="1"/>
        <xs:attribute name="default" type="xs:integer"/>
      </xs:extension>
    </xs:complexContent>
  </xs:complexType>

  <!-- Decimal Parameter Declaration -->
  <xs:complexType name="DecimalParamDef">
    <xs:complexContent>
      <xs:extension base="ParamBaseDef">
        <xs:attribute name="default" type="xs:decimal"/>
      </xs:extension>
    </xs:complexContent>
  </xs:complexType>

  <!-- Duration Parameter Declaration -->
  <xs:complexType name="DurationParamDef">
    <xs:complexContent>
      <xs:extension base="ParamBaseDef">
        <xs:attribute name="default" type="DurationType"/>
      </xs:extension>
    </xs:complexContent>
  </xs:complexType>

  <!-- Date Parameter Declaration (yyyy-MM-dd) -->
  <xs:complexType name="DateParamDef">
    <xs:complexContent>
      <xs:extension base="ParamBaseDef">
        <xs:attribute name="default" type="xs:date"/>
      </xs:extension>
    </xs:complexContent>
  </xs:complexType>

  <!-- Time Parameter Declaration (hh:mm:ss) -->
  <xs:complexType name="TimeParamDef">
    <xs:complexContent>
      <xs:extension base="ParamBaseDef">
        <xs:attribute name="default" type="xs:time"/>
      </xs:extension>
    </xs:complexContent>
  </xs:complexType>

  <!-- Date-Time Parameter Declaration (yyyy-MM-dd'T'hh:mm:ss) -->
  <xs:complexType name="DateTimeParamDef">
    <xs:complexContent>
      <xs:extension base="ParamBaseDef">
        <xs:attribute name="default" type="xs:dateTime"/>
      </xs:extension>
    </xs:complexContent>
  </xs:complexType>

  <!-- Integer Range Parameter Declaration (Range control) -->
  <xs:complexType name="IntegerRangeParamDef">
    <xs:complexContent>
      <xs:extension base="ParamBaseDef">
        <xs:attribute name="min" type="xs:integer" use="required"/>
        <xs:attribute name="max" type="xs:integer" use="required"/>
        <xs:attribute name="step" type="xs:integer" default="1"/>
        <xs:attribute name="default" type="xs:integer"/>
      </xs:extension>
    </xs:complexContent>
  </xs:complexType>

  <!-- Double Range Parameter Declaration (Range control) -->
  <xs:complexType name="DoubleRangeParamDef">
    <xs:complexContent>
      <xs:extension base="ParamBaseDef">
        <xs:attribute name="min" type="xs:double" use="required"/>
        <xs:attribute name="max" type="xs:double" use="required"/>
        <xs:attribute name="step" type="xs:double"/>
        <xs:attribute name="default" type="xs:double"/>
      </xs:extension>
    </xs:complexContent>
  </xs:complexType>

  <!-- Text Parameter Declaration (with validation rules) -->
  <xs:complexType name="TextParamDef">
    <xs:complexContent>
      <xs:extension base="ParamBaseDef">
        <xs:attribute name="minChars" type="xs:nonNegativeInteger"/>
        <xs:attribute name="maxChars" type="xs:positiveInteger"/>
        <xs:attribute name="pattern" type="xs:string"/>
        <xs:attribute name="default" type="xs:string"/>
      </xs:extension>
    </xs:complexContent>
  </xs:complexType>

  <!-- Parameters and Settings Container for Blocks -->
  <xs:complexType name="ParametersDef">
    <xs:sequence>
      <xs:element name="attribute" type="AttributeDef" minOccurs="0" maxOccurs="unbounded"/>
      <xs:choice minOccurs="0" maxOccurs="unbounded">
        <xs:element name="setting" type="SettingDef"/>
        <xs:element name="parameter" type="SettingDef"/>
        <xs:element name="integer-parameter" type="IntegerParamDef"/>
        <xs:element name="count-parameter" type="CountParamDef"/>
        <xs:element name="decimal-parameter" type="DecimalParamDef"/>
        <xs:element name="duration-parameter" type="DurationParamDef"/>
        <xs:element name="date-parameter" type="DateParamDef"/>
        <xs:element name="time-parameter" type="TimeParamDef"/>
        <xs:element name="date-time-parameter" type="DateTimeParamDef"/>
        <xs:element name="integer-range-parameter" type="IntegerRangeParamDef"/>
        <xs:element name="double-range-parameter" type="DoubleRangeParamDef"/>
        <xs:element name="text-parameter" type="TextParamDef"/>
      </xs:choice>
    </xs:sequence>
  </xs:complexType>

  <xs:complexType name="SettingsDef">
    <xs:complexContent>
      <xs:extension base="ParametersDef"/>
    </xs:complexContent>
  </xs:complexType>

  <!-- Factory binding definition -->
  <xs:complexType name="FactoryDef">
    <xs:sequence>
      <xs:element name="attribute" type="AttributeDef" minOccurs="0" maxOccurs="unbounded"/>
    </xs:sequence>
    <xs:attribute name="id" type="xs:string" use="required"/>
    <xs:attribute name="type" type="TypeString"/>
  </xs:complexType>

  <!-- Block Definition -->
  <xs:complexType name="BlockDef">
    <xs:sequence>
      <xs:element name="attribute" type="AttributeDef" minOccurs="0" maxOccurs="unbounded"/>
      <xs:choice minOccurs="0" maxOccurs="unbounded">
        <xs:element name="var" type="TypeVarDef"/>
        <xs:element name="param" type="TypeVarDef"/>
      </xs:choice>
      <xs:element name="factory" type="FactoryDef" minOccurs="0"/>
      <xs:element name="parameters" type="ParametersDef" minOccurs="0"/>
      <xs:element name="settings" type="SettingsDef" minOccurs="0"/>
      <xs:choice minOccurs="0" maxOccurs="unbounded">
        <xs:element name="in" type="PortDef"/>
        <xs:element name="out" type="PortDef"/>
        <xs:element name="input" type="PortDef"/>
        <xs:element name="output" type="PortDef"/>
        <xs:element name="relation" type="TypeRelationDef"/>
        <xs:element name="type-relation" type="TypeRelationDef"/>
      </xs:choice>
    </xs:sequence>
    <xs:attribute name="id" type="xs:string" use="required"/>
    <xs:attribute name="name" type="xs:string" use="required"/>
    <xs:attribute name="ns" type="xs:string" use="required"/>
    <xs:attribute name="icon" type="xs:string"/>
  </xs:complexType>

  <!-- ROOT ELEMENT: blocks -->
  <xs:element name="blocks">
    <xs:complexType>
      <xs:sequence>
        <xs:element name="attribute" type="AttributeDef" minOccurs="0" maxOccurs="unbounded"/>
        <xs:choice minOccurs="0" maxOccurs="unbounded">
          <xs:element name="namespace" type="NamespaceDef"/>
          <xs:element name="type" type="TypeDef"/>
          <xs:element name="block" type="BlockDef"/>
        </xs:choice>
      </xs:sequence>
      <xs:attribute name="id" type="xs:string" use="required"/>
      <xs:attribute name="name" type="xs:string" use="required"/>
      <xs:attribute name="icon" type="xs:string"/>
    </xs:complexType>
  </xs:element>

</xs:schema>
